id,name,description,neighborhood_overview
2593335,"Separate private studio/own bath, ocean view","Separate studio with queen bed/bath, kitchenette (fridge/hot plates) cooking utensils, microwave, toaster oven, coffee machine, 40"" TV, Wi-Fi. Complementary goodies for continental breakfast for first days. 240V for an electric car to plug in.  Enjoy sunsets from the balcony.<br /><br /><b>The space</b><br />Our house is located in the Muirlands, a  very private and quiet neighborhood. The studio with kitchenette has a separate entrance. It is small (250sqft) but well designed. It also has it's own balcony with ocean view. We have a microwave, toaster oven, pots & pans, and coffee machine in the unit. In the fridge you will find some essentials such as juice, milk, butter, cream cheese, and some bagels or rolls for your first day. A fruit plate, some snacks, coffee and tea are included. We also have a freezer which is outside with extra ice. It also can be used to keep ice cream etc. A fan or heater is available, if needed.  There is off street parking for our guests. No smoking inside","It is very quiet in the Moorlands and it is a very safe area. We are about 1 mile from the famous Windansea Beach  and 1.5 miles from downtown La Jolla  with lots of restaurants. At the  Cove and Children's Pool (2 mi)  you can see lots of sea life. La Jolla Shores (3 mi) is good for surfing, kayaking, swimming or walking along the beach. From the top of Mount Soledad (3/4 mi) one can enjoy a breathtaking 360' view of our beautiful city. We also have an outdoor shower for rinsing off the sand from the beach. Thanks for being considerate."
2594607,Ocean View Beach House w/AC *CDC Enhanced Cleaning,"Our Beach House is spacious at 1200 sqft. with 16 ft. vaulted ceilings, 2nd story, 2BR/2BA Ocean View, plus 2 sun decks, and parking for 2 cars.  Located at the Southern border of La Jolla, in a unique North Pacific Beach neighborhood, next to the water, at Law St Beach!  Just a 2-3 minute walk to the sand.<br /><br />We are Dog Friendly and perfect for families, or Friends ( up to 6 people ) who want to be able to walk to the beach,  walk or bike to restaurants, shops, and markets.<br />Yes... we have A/C<br /><br /><b>The space</b><br />Our location is perfect... close to everything the beach has to offer, while at the same time, our little neighborhood is quietly removed from the hubs of activity for a great night's sleep. You will hear the waves breaking, and be enveloped by the sea breezes. <br /><br />    *FYI...    We follow CDC and local S.D. County Health Dept. cleaning and disinfecting guidelines... We require a minimum 24 hour wait period between reservations. This includes ","Your Beach House is close to everything the beach has to offer, while at the same time, our little neighborhood is quietly removed from the hubs of activity. After a day of relaxing at the Beach or sitting on your shaded deck, watching the world pass as the ocean breezes drift by, you can take a Boardwalk stroll or Bike ride (we supply the bikes). Check the sunset at the park out front, and head out to one of our many nearby restaurants...  (we send our recommendations .) You always have the option to light up the BBQ  and enjoy the great ocean view kitchen we have provided...just hang out at the house, or head out for nightlife.  Choices are yours... you can't loose."
2598921,Contemporary East Village Loft,"This East Village loft is near the Convention Center, Petco Park and the Gaslamp.  This studio was decorated by a local interior design firm and is the perfect getaway - clean, stylish, comfortable and quiet.<br /><br /><b>The space</b><br />This East Village loft is near the Convention Center, Petco Park and the Gaslamp.  This studio was decorated by a local interior design firm and is the perfect getaway - clean, stylish, comfortable and quiet.  <br /><br />- free parking included<br />- hardwood floors<br />- custom wall tiles<br />- 42"" plasma TV<br />- Netflix and Att TV - formerly “DirectTV Now”<br />- Apple TV<br />- wifi<br />- Cal King bed+ full size pull out bed<br />- stainless steel appliances (and dishwasher)<br />- washer/dryer in the condo<br />- ceiling fan<br />- AC<br /><br />• Underground gated secure parking <br />• Secure elevator and front door access via key fob <br />• Gym on 1st parking lot level <br />• Kitchenware/appliances <br />• Washer/dryer<br /><br />I'","East Village is a very safe and vibrant area.  It's close to Petco Park, the Gaslamp District and the Convention Center.  You're within a 1-5 min walk to coffee, bagels, breakfast, bars, bowling, the bay, Gaslamp, the library, trolley station and much more."
2601234,Downtown San Diego Gaslamp Studio,"Right in the heart of the Gaslamp District.  Short walking distance to all of the downtown attractions like baseball, convention center and restaurants.  9th Floor with a balcony view.  Pool, Hot Tub, Gym. Parking.  50"" HDTV.  Cable not included but chrome stick with TV so you can order streaming cable, netflix, etc.",
2606578,Central San Diego Location: Private Patio & AC,"You will love our detached updated studio and private entrance and patio.  The studio is fenced off from the main residence allowing guests their privacy and plenty of room for social distancing. Located in the historic North Park neighborhood in the heart of San Diego, just north of Balboa Park. Under a mile to the San Diego Zoo and all the Balboa Park Museums. Beach less than 15 min away.<br /><br /><b>The space</b><br />This is a private detached studio apartment with a full bathtub/shower with its own private entrance, patio and parking space.  It is fenced off from the main residence.<br /><br />You have your own locked entrance to the studio off the side street. The fence can be rolled open and you can park your car within the patio if you wish. There is plenty of free street parking.<br /><br />A 10’ privacy fence separates the studio/patio from our backyard and house.   <br /><br />Your space is private, but you may be able to hear us on occasion as we are just next door.  <br ","The Suite is located in North Park. The North Park neighborhood is home to Craftsman cottages, wide variety of excellent restaurants, coffee shops, several microbreweries, and shops. <br /><br />North Park has a quiet neighborhood feel right in the middle of the city. 10-15 minutes from all major San Diego must see spots."
2607752,Cozy Studio with Private Patio on a Canyon in Mission Hills,The double pairs of French doors lead directly from the European style bedroom to a private patio. Sit back and relax in the breeze with a book and a cold beverage. Fire up the barbecue or take a short stroll and admire sweeping views into the canyon.,"The studio in a historic neighborhood on a quiet street, and is walking distance to great restaurants, coffee shops, and stores. It is only a 10-minute drive to most attractions in San Diego, such as the beaches, Sea World, the Zoo, and downtown."
2620322,South Mission Beach Zen-Like Studio,This fully furnished second story South Mission bayside studio offers relaxed beach living. This studio sleeps 2 (Queen Bed) & 2 Boogie Boards are provided; private off street parking; steps to the bay and short stroll to the beach.<br /><br /><b>Guest access</b><br />Guests will have access to private off-street parking; and two boogie boards.  There is also a small patio with a grill.,
2633036,Elegant medditreannean Studio by SDSU & Stadium,"Charming private studio apartment (guesthouse) near SDSU, centrally located in the neighborhood of El Cerrito/College Area in San Diego, 20 mins to  (Sea World, Comic-Con,North Park,South Park, Hillcrest, beaches, downtown). The studio is a separate unit from the main house, and it has it's own private entrance, bathroom and kitchen with a comfortable queen bed. The neighborhood (El Cerrito) is very quiet and quaint near San Diego State University (SDSU) ,Cal Coast Amphitheater & the stadium.<br /><br /><b>The space</b><br />**Please read entire listing and all notes/rules.**<br />The studio is spacious, we just remodeled it completely and bought brand new furniture. It's more like a very nice hotel suite.  <br />**Street Parking only** There is always street parking available, the street can be busy every once in awhile, but you will find parking Follow parking rules: cramp your wheels to the curb if you're on downhill and fold your mirrors. <br />The space is perfect for couples who ","EL Cerrito /College area is a very unique part of  San Diego. We have couple of nice restaurants and little local coffee shops.  the Neighborhood is centrally located, you can go anywhere fairly quickly (15-20 mins based on traffic): downtown, beaches, stadium, sea world, comic-con. We're  located by San Diego State University (SDSU, Go Aztects !) and Cal Coast Credit Union Amphitheater. In addition, the Stadium is 5 miles away.<br /><br />North Park, South Park, Normal Heights are also nearby (10-15 minutes depending on traffic).<br /><br />La Jolla, Coronado , TJ, Mexico, are 25-30 minutes away."
2636301,Stylish Canyon Home Central to Everything,"This charming, centrally located canyon home underwent a full renovation in 2014 (new stainless appliances, flooring, custom cabinetry, granite counters, bathroom fixtures). You'll sleep in a quiet pocket of the vibrant Hillcrest neighborhood, yet just a short walk across a cute pedestrian bridge leads to shopping/eateries/bars. Attractions like Balboa Park/Zoo, SeaWorld, beaches, Gaslamp/Convention Center are nearby. Live like a local while enjoying all our beautiful city has to offer.<br /><br /><b>The space</b><br />This charming, centrally located canyon home underwent a major renovation in June 2014 complete with new appliances. It still feels and looks brand new! Located in the eclectic neighborhood of Hillcrest, the house is walking distance to shopping, a vibrant nightlife and a plethora of restaurants, and is just minutes by car to all of San Diego’s main attractions. Staying here is a great alternative to hotels and noisy beach condos. You’ll feel like one of the residents in","Hillcrest is a friendly and fun neighborhood filled with vibrant shopping, bars and restaurants. Everything you want is here and within walking distance. Enjoy the weekend farmer's market not far from our home - it's one of the best in the city."
2658016,La Jolla Shores Beach Landing 2 Blocks From Ocean,"2 blocks from La Jolla Shores! Live the beach life. Beautiful upscale neighborhood within 2 minute walking distance to restaurants, cafes, and world famous beach of San Diego’s Jewel - La Jolla. Surf, kayak, paddle board, snorkel! <br /><br />This is a queen size couch in a shared common space. Single females only please! Thank you! Mahalo.<br /><br /><b>The space</b><br />Smell the salty air, listen to the waves crash as you sleep. You will fall in love with this location!","Upscale beach area. Two blocks away is where all the tourists amenities are (hotels, resorts, fine dining, boutiques). It's a very quiet street until you walk a block out! So you get the best of both worlds. There is tennis and golfing at the Beach and Tennis Club for members or guests of the club."
2664145,Fabulous Mission Beach Ocean Front Condo,"Newly remodeled downstairs and kitchen - Jan 2018!<br />Walk out the front door to the sand, enjoy all the fun that Mission Beach has to offer. Located conveniently within 15 minutes to the San Diego Airport, Old Town, Downtown Gaslamp District, Petco Park, Convention Center, Sea World<br /><br /><b>The space</b><br />On the ocean.   Steps to the sand.  Your own private patio on the boardwalk.   Best people watching in San Diego!  Decorated with beach decor.  We are close to restaurants, shops and the Famous Belmont Park roller coaster!<br /><br /><b>Guest access</b><br />It is a ground floor unit on the ocean with three bedrooms upstairs.   You will enjoy the view from the master bedroom glass balcony, the flat screen tv’s in every bedroom, free wireless internet, and personal patio area with an outdoor BBQ.<br /><br /><b>Other things to note</b><br />The condo features a tandem parking garage. We have 3 beach bikes, chairs, boogie boards, beach towels, an umbrella and a cooler for yo","Located at 3405 Ocean Front Walk, about 6 blocks north of Belmont Oceanfront Park.   We are also located adjacent to Mission Bay Park which offers paths for walking, jogging, and playgrounds for children.   It is one of San Diego’s most popular locations to fly a kite, picnic or sail.<br /><br />It is located at 3405 Ocean Front Walk, about 6 blocks north of Belmont Oceanfront Park.   We are also located adjacent to Mission Bay Park which offers paths for walking, jogging, and playgrounds for children.   <br />It is a ground floor unit on the ocean with three bedrooms upstairs.   You will enjoy the view from the master bedroom glass balcony, the flat screen tv’s in every bedroom, wireless internet, and personal patio area with an outdoor BBQ."
2702647,"Location, Location, Location!  Bankers Hill!","Located in banker's hill bordered by Little Italy & Downtown duplex, 4 blocks to Little Italy/Balboa Park, a mile to Gaslamp/Convention center. The area is teeming w/trendy restaurants and lively nightlife, as well as a spectrum of boutique shops. Double pane windows, buffer out the air traffic with 5 minute travel time to and from the airport.  Incredible downtown/ocean views from the balcony off the master suite. 10.5% booking fee is due before check-in which is NOT included in AIRBNB charges.<br /><br /><b>The space</b><br />Guests will not have access to the garage. Pets required to be on a monthly flea program, to be housebroken, and to not suffer from separation anxiety.  Preapporval required.<br /><br /><b>Guest access</b><br />Guests will have access to the house but not to the garage.<br /><br /><b>Other things to note</b><br />A few house requests that can be very costly to fix: The toilets can not tolerate any foreign objects/material (i.e. feminine products, paper towels, n","You couldn't get a better location, pick the direction you want to walk and in four/five blocks you will be in the heart of one of San Diego's tourist attractions!"
2703885,North Bay Bungalow,"This is a great house for a fun family holiday. Unwind as you watch the boats sail by from your spacious outdoor deck. The game room alone, makes this place an ideal vacation spot. The sandy shores of the bay are right outside your gate.<br /><br /><b>The space</b><br />Sleeping Layout<br />Master: Queen Bed<br />2nd Bedroom: Queen Bed<br />3rd Bedroom: Queen Bed<br /><br />3 Bedrooms/2 Baths<br />Sleeps: 6 and 1600 Square Feet<br /><br /><b>Guest access</b><br />Parking : There are two outside parking spaces.<br /><br />* High Speed Internet<br />* Patio<br />* Gas BBQ<br />* Fireplace<br />* There is Room for an Air Mattress.<br />* Pool Table<br />* This is a Two Story h\House.<br /><br /><b>Other things to note</b><br />***RESERVATIONS: THIS PROPERTY REQUIRES A THREE NIGHT MINIMUM IN THE OFF SEASON AND A FULL WEEK (SATURDAY - SATURDAY) IN THE SUMMER MONTHS***<br />PLEASE NOTE THAT THE MONTHLY DISCOUNT DOESN'T APPLY TO JUNE THRU AUGUST DATES!!  PLEASE DO INQUIRY ABOUT FURTHER DISCOU",This house is located on the North East side of Mission  Bay.
2728811,P Beach Granny Flat Ocean View Deck,"We have instituted Airbnb’s suggested cleaning protocols in response to Covid19. <br /><br />Unique non-smoking, one bedroom w/bathroom & living room. A sliding door provides a lovely view of garden & fountain. Exclusive use of patio w/BBQ & table. Use of yard, roof top deck/ocean view, firepit, BBQ, bikes, beach toys, etc. Walk/bike to everything.<br /><br /><b>The space</b><br />We have instituted Airbnb’s suggested cleaning protocols in response to Covid19. <br /><br />Quiet neighborhood.  Please respect the ""village"" by being quiet between the hours of 10 pm and 8 am.  Walk to the beach or the bay, restaurants or bars or shopping.  New, bamboo floored retreat.  This has a queen size bed and is ground floor so handi- accessible. The sofa is a sleeper couch and not the weird unfolding one. Comfortably sleeps 4.  It can be combine with other listing (which is above it) for a 2 bedroom 2 bath and has sleeper mats for kids or extra folks.<br /><br /><b>Guest access</b><br />Shared areas","I love that you can walk to anything of interest in Pacific Beach, including the beach and the bay. It is quiet here and there is a great sea breeze to keep you cool. Much fun can be had when taking the bikes and going to the beach for volleyball, boogie boarding or just walking/riding the board walk."
2730356,Perfect in Every Way! 1-BDR APT.,"*Note: NO THIRD PARTY RENTERS, please!*<br /><br />This newly remodel unit is adjacent to our home (attached to it), with its own private entrance.<br />Fully equipped with A/C, WI-FI/HDTV, Cable.<br />Also, you have a beautiful seating area in the backyard, overlooking the canyon.<br /><br /><b>The space</b><br />Comfortable, clean and airy apartment overlooking a canyon; centrally located in the residential neighborhood Mission Village, just about a mile above the Qualcomm Stadium. A very convenient short drive to the Stadium where you can park for free and take the Trolley to many attractions!<br />About a mile away from Costco, Ikea and 15-20 minute drive to the beach and coastal attractions. We are 6 1/2 miles away from San Diego Zoo and 9 miles from Downtown.<br /><br />Smoke free.<br />Fully equipped. <br />Queen size bed.<br />Wireless Internet.<br />Central A/C, heating.<br />Cable, HDTV.<br />Dine ""Alfresco"" in the backyard, overlooking the canyon. A grill can be provided wit",
2747722,Spacious Beach Studio w/Air Conditioning!!!,"This awesome studio is located in the middle of Mission Beach just 1/2 block to the sand!  Many restaurants, cafes, and shops within a few blocks.<br /><br />Stay for a few days or a month... and really see what the beach life is like...<br /><br />Beautifully remodeled.  All new furniture, flooring and bathroom!  Perfect for a couple, or business travelers.<br /><br /><b>The space</b><br />This awesome studio is located in the middle of Mission Beach just 1/2 block to the sand!  Many restaurants, cafes, and shops within a few blocks.<br /><br />Unlike many beach properties...  This studio has Air Conditioning!<br /><br />A comfortable queen bed, bright dining area, and super fast WiFi make this an ideal place to work remotely.<br /><br />There is a TV with Netflix and Sling TV which allows you to watch most of your favorite TV shows live and many on demand too!  <br /><br />Apartment has a keypad for entry, so you don't need to worry about having to keep track of keys.<br /><br /><b>G","We are located in the center of Mission Beach with everything you need only a block or two away. (A large grocery store is about 1/2 mile away.)<br /><br />-- 1/2 block to the bay<br />-- 1 1/2 blocks to the beach<br />-- 1 to 3 blocks away from a few amazing cafes and coffee shops.<br />-- 1/2 mile to Garnet Ave; which makes up the heart of Pacific Beach, where you can find great shopping, restaurants, bars, coffee shops, Trader Joe's, Vons, a 24 hour fitness, many yoga studios, and much more..<br />-- 1 block to the nearest bus stop.<br />-- 1 mile to Historic Belmont Park where you can ride the roller coaster, eat some ice cream, and watch the people walk by as you enjoy a drink at one of the oceanfront bars/restaurants. <br />-- 3 miles to Sea World<br />-- 8 miles to North Park - The center of hip beer bars and breweries!<br />--Less than 9 miles to Downtown San Diego and the Gaslamp Quarter; which provide fun night life and more upscale restaurants and bars.<br />-- 9 miles to th"
2763850,Very nice 1bd 1ba condo near beach,"Note: This is monthly rental or longer only. Great for traveling nurses, doctors business professionals. Not set up for children however. Top floor, newly remodeled 1bd + 1ba  condo is close to: Beaches, Sea World, Mission Bay, Old Town. Beautiful view of the tropical courtyard. Many amenities onsite.<br /><br /><b>The space</b><br />This beautiful condo is close to all things San Diego - beach, bay, Sea World, Old Town! Also, Downtown and the Airport are only a few miles away. Kitchen is fully equipped and there are plenty of comforts like home. The facility has beautiful tropical grounds  feels like a resort with ponds, fountains, walking path and many sport accommodations.<br /><br /><b>Guest access</b><br />for your enjoyment, I provide all the toys you need for tennis, volleyball, badminton, ping pong and the pool. The exercise room has a steam room and a hot dry sauna.<br /><br /><b>Other things to note</b><br />The 2nd queen size bed is in the living room in the hide-a-bed couch",The condo is 2 blocks from the best local market with the most gluten free foods and many local organic produce options. Sea world is  only 1 mile away and so is ocean Beach.  Ocean Beach has many outstanding restaurants!
2771788,Awesome North Park 1 bedroom Condo,"Northpark is a fantastic, up and coming neighborhood within walking distance of Balboa Park and a 10 minute drive downtown. It's packed with bars and trendy restaurants. The apartment is right in the middle of all this, walking distance to it all.<br /><br /><b>The space</b><br />Northpark is a fantastic, up and coming neighborhood within walking distance of Balboa Park and a 10 minute drive downtown. It's packed with bars and trendy restaurants. The apartment is right in the middle of all this, walking distance to it all.<br /><br />+Charming 1 Bedroom, 1 Bath, in a gated complex <br />+Luxurious Queen size bed and a big sectional couch that sleeps 2.<br />+Hardwood floors <br />+Completely redone, new kitchen and bath <br />+Laundry onsite (coin-op) <br />+Dishwasher <br />+ Stove <br />+Microwave <br />+Large Refrigerator <br />+Very cozy <br />+ Small front patio <br />+Off street parking for 1 small car, free street parking for other cars <br />+ Very friendly neighborhood<br />+ ","The home is located in the heart of North Park where you can walk to all types of neighborhood shops, boutiques, coffee houses, pizza parlors, pubs, dive/sports/wine bars, breweries, ice cream, yogurt, sushi, burgers, tacos, grocery/convenience stores, parks, gym, salons, and more. Take a dance class at one of the nearby studios or an evening cooking class where you’ll meet new friends."
2777781,Historic Gallagher Home (2),"A home built in 1912, this home is located in the Banker's Hill area of San Diego.  We have three rooms listed and available at this location.  Two people per room. Maximum 14 day stay.  Two night minimum stay, no cleaning fee.<br /><br /><b>The space</b><br />Temporary lodging on 2nd floor for visitors to San Diego.  Note: $90 price is for ONE person, as is the weekly rate. Second person is at an additional charge.  <br /><br />You are welcome to stay in the house up till 2 PM the day of your check but must vacate the room by 11 am so that it can be cleaned for the next guest.<br /><br />House and area is located between downtown and Hillcrest. Close to Balboa Park, the bay, beaches, and airport. Bus lines are seconds away. A private room with a queen-size bed (medium firm). Built in closest. Private bath located outside room. Kitchen available for light cooking. Front porch, backyard pool and hot tub.   I also have two additional rooms available, if you are looking for more room!<br ","Banker's Hill is close to Mission Hill and uptown from San Diego's bustling downtown district is the trendy and hip neighborhood of Hillcrest. A hub of locally owned businesses, visitors will find a diverse and eclectic collection of boutiques, thrift stores, diners, restaurants and bars. Hillcrest offers an authentic, local San Diego vibe, where locals and travelers alike mingle to enjoy the colorful community offerings.<br /><br />The most popular dining and shopping hot spots in Hillcrest are concentrated in ""The Village"" area that runs along Washington and University Avenues, between Fourth and Fifth Avenue. But there are plenty of hidden gems scattered throughout the neighborhood.<br /><br />Also home to San Diego's LGBT community, Hillcrest hosts a variety of events and festivals each year, including the festive Gay Pride Parade in the summer. Enthusiastic supporters of the arts, Hillcrest's LGBT community has helped launch a number of excellent restaurants, cafes, art galleries,"
2801479,"San Diego, Snowbirds Delight! Golf, Sunshine!","PLEASE READ:<br />Now booking  September and beyond.  Please send me a quick reservation request and note and I will get you approved for booking.   Not knowing  September through winter changes in guest's plans ,  availability  may open. I have reserved time not showing on my calendar so please reach out to me for current availability. Thanks to all my return guests!<br />Pets: on approval,  pet cleaning fee $100. <br />Two Cal King beds, in each bedroom with your own en-suite baths, airbeds avail.<br /><br /><b>The space</b><br />My house is a  two story townhome, with bedrooms upstairs. The entry on the first floor opens into a newly painted bright living room with a mid-century flair.  Enjoy the use of the living room, kitchen, washer and dryer, cable television with premium channels, high speed wireless internet and wireless printer. For business travelers there is a desk with privacy so you can work undistracted.  The sunroom, patio and bedroom boast a great view of the golf cour","Within 20-25 minutes you can visit beaches,  Balboa Park, San Diego Zoo, Sea World, Wild Animal Park, Little Italy, Gaslamp District, Golf, swim, tennis 5 minutes! LEGO land, Wineries, Casinos 20-30 minutes. Uber and lift available.<br /><br />Gym, grocery stores, eateries within 5 minutes!"
