id,name,description,neighborhood_overview
1987740,"Bright, Clean & Airy 600+ sq ft Apartment Near All","Private-Entry Guest House in a quiet single-family neighborhood, on a secluded cul-de-sac.  Beautiful new Vinyl-Plank Floors, Custom Built-In Desk, Beaches, Shopping Malls, Balboa Park, and Sea World. Close to Sharp Hospital and Children's Hospital, Full-Size Fully-Stocked Kitchen & Bathroom. New Queen-size memory foam bed in bedroom area & Full-size Murphy bed in the living room! Central Heat & A/C, High-Speed Internet, Cable TV. Full-Size Washer/Dryer as well. All utilities Included!<br /><br /><b>The space</b><br />Private-entrance guest house / granny flat behind our home, tucked away on a little-used cul-de-sac in a quiet residential neighborhood called Birdland. <br /><br />Very large, light & airy, over 600 square feet.  Also includes use of a full-size washer and dryer.  Beautiful new Vinyl plank floors throughout.  Also, a nice built-in desk/counter area overlooking a beautiful orange tree.  The perfect location that allows you very quick access to all of San Diego must-see de","Our neighborhood is well established, with most homes being built in the early '60's.  There is really just one road into ""Birdland"" (all streets have bird names), so there is no through traffic.  Our apartment is close to everything, but also has the advantage of being off the beaten path (i.e., not in a noisy, congested part of town).  If a peaceful, cheerful respite is in order, we have the place for you.  Quiet, but very accessible."
2005108,2bed 2bath Close to All. Near ZOO with air.parking,"air.Easily sleeps 6. free parking mid size car. Full kitchen. 2 bathrooms. Living room w/big screen tv and dining area. We are in the middle of whats happening in San Diego.<br /> Pet friendly friendly dogs no cats<br /> with common deck on Trolley Barn Park. Great 4 kids w/jungle gym and swings in park. older unit but modern amenities<br />north of adams<br /><br /><b>The space</b><br />this upstairs  unit is a 2 bedroom 2 bath apartment<br /> with off street parking.one car not designed for big trucks or vans<br /> Has most all you need including wi fi, internet and cable. <br /> Sleeps 6  comfortably with a great outside area.<br /> park next door.really kid friendly swings and slides jungle gyms<br /><br /><b>Guest access</b><br />with the shared deck and patio enjoy San Diego weather year round<br /><br /><b>Other things to note</b><br />stairs second floor unit","older building in University Heights Village is a walking neighborhood. Our place being on the park is a destination. We see all types. Lots of smiling faces going by. Also dog walkers, joggers and sunbathers. We are also a coffee shop area with restaurants and bars. Everything from the best Mexican fast food in San Diego to two Thai restaurants. One being vegan. Also French, Ethiopian, Armenian, Iranian, barbecue, American and more. We are within 2 blocks of many neighborhood bars. Straight and gay. There is a Buddhist Temple and churches. University Heights has a massage School and inexpensive clinic. we are on the bus line."
2012228,Peaceful Ocean themed Oasis,"Beautiful room in central San Diego, nice comfy country chic home less than 15 minutes to most locales in San Diego ie: SeaWorld, La Jolla, Pacific Beach, Old Town, Downtown. Walking distance to many restaurants, movies, with refrigerator access, BBQ, fire pit, canyon park close by for great hikes. la Jolla shores 10 minutes away by car.  Enjoy!<br /><br /><b>The space</b><br />for these dates if you prefer to be only one in house let me know I'll close off the other room for small fee. I ask that you limit contact to other parts of house to help keep cleaning fees down. This room has new floors and has just been painted, my home is a constant work in progress and I love that. I hope you enjoy it as much as I do.  I have worked at many Hotels, it makes me aware of what is good service. I try to have things more casual and unfettered like airbnb homes are. so make yourself at home. Chat with me when you need to.  Finding a check in time helps my schedule.<br /><br /><b>Guest access</b><","Great location, Clairemont is close to everything,  walking distance to so much local charm. <br />The idea of hopping a bus or driving 10-15 minutes to practically all the highlights of San Diego is such a great benefit for a traveler."
2020499,Best Location; close to bay but on quiet canyon,"Our home has the view as if you are away from the city but one of the most central location in San Diego.   Very close to bay and beach!   <br />Open floor plan.  Great for enjoying the kitchen and outdoors!<br /><br />We highly value our vacation time; including nice beds, sheets, pillows, etc. so we treat you the same.  We keep separate high quality air bnb linens & pillows.  We are not a hotel but we want you to feel valued as such. <br /><br />Very kid friendly: games, toys, pool floaties, kid books, trampoline park<br /><br /><b>The space</b><br />Comfortable CLEAN home in very SAFE & QUIET neighborhood. <br /><br />Feel like you are in your own getaway resort in the backyard with huge canyon view  & pool, but minutes away from local attractions, like Sea World, the bay, the beach, Belmont Park Rollercoaster, downtown, etc.<br /><br />Included:<br />BASIC home supplies<br />parking<br />Wifi (2G & 5G network) <br />Linens, Sheets<br />bath Towels & pool towels <br />Beach & Pool t","We love that it's quiet & private, with a canyon view, yet so close to the beach and bay and central San Diego.<br /><br />All of our neighbors have lived here many years so this is a neighborhood of neighbors watching out for eachother & helping eachother."
2021509,"Mini Hotel, but better!","Come stay at our 8 bedroom 4 bath home in Mission Valley San Diego. We are 15 minutes from the Zoo, Seaworld, Mission beach, Pacific beach, La Jolla, Downtown San Diego Gaslamp district, or Old town for some good Mexican food!",
2023443,"2. Close to Qualcomm UCSD,Clean,WIFI,AC,Parking","Clean beautiful room in a safe and quite neighborhood. The bed is queen size.<br />It's located at Mira Mesa. Close to restaurant and shops.<br />Minutes to Qualcomm, UCSD.<br />20 minutes drive to all San Diego (La Jolla, Torrey Pines, Mission Bay, Pacific Beach, Old Town, Balboa Park, Sea world, Zoo, Gaslamp Quarter, Coronado... ).<br />Room #1 and #2 shared a bathrooms. All our houses remodeled, very clean.<br />We provide towels, shampoo, conditioner, and body wash, hairdryer. You can do laundry. The washer and ....<br /><br /><b>The space</b><br />The bed is queen size.<br />It's located at Mira Mesa. Close to Qualcomm, UCSD and La Jolla, Del Mar... <br />Room #1 and #2 shared a bathrooms. All our houses remodeled, very clean.<br />We provide towels, shampoo, conditioner, and body wash, hairdryer. You can do laundry. The washer and dryer in the garage. And there are iron and ironing board. You can use kitchen and all the kitchen stuffs. There are refrigerator, microwave, toaster, ",
2043138,PB Pier Surfside Studio w/AC+parking+surfboards,"Steps away from the beach on Emerald Ct, smell the ocean air from this spacious studio that has surfboards, boogie boards, and parking for two cars! You're setup for an amazing treat. Bigger group? You can also rent the beach house (sleeps 8) that's on the same lot.<br /><br /><b>The space</b><br />Airbnb at times will restrict who can travel and stay at certain listings. If for some reason Airbnb is not allowing you to book, please message the hosts and we will take care of the issue. <br /><br />**** **Do not use instant book if staying less than 3 nights. Please email me to inquire first.**<br />**There is a 3 night minimum on weekends and a 2 night minimum during the week unless you are filling a gap in the calendar**<br /><br />*** 1 night reservations will not be accepted on Friday or Saturday nights unless they're filling a gap in the calendar. If you book Friday night, you must also stay saturday night and vice versa. All instant book reservations that don't adhere to this will","Pacific Beach is a wonderful neighborhood with so much to do! Within walking distance you can enjoy paddle boarding, surfing, jet ski rentals, power boat rentals, kayaking, snorkeling, yoga, shopping, eating, drinking, you name it! Within a 10 minute drive you have access to SeaWorld, the famous San Diego Zoo, epic deep sea fishing and beautiful world famous beaches such as the La Jolla Cove. Visit energetic downtown and Gaslamp districts or check out some of our world famous breweries. Within a 20 minute drive you can enjoy Coronado Island, The Wild Animal Park, SCRIPPS aquarium and Lego Land. In sunny San Diego the list of things to do is endless!"
2055118,Marina District Walk to Convention Quiet Clean Apt,"Located in the Marina District Downtown - Easy access -  Less than 3 miles to the SAN Airport - 1/2 mile  Amtrak - 1/2 mile Coronado Ferry - 2 min walk to Trolley - 10 min walk to the Gaslamp, grocery store, bars, restaurants, the Embarcadero, Seaport Village, USS Midway,  Convention Center, Marriott Marquis, Manchester Grand Hyatt, Petco Park, Little Italy, Waterfront Park, and other downtown attractions.  A quiet secured building - your stay will provide great rest for work or play!<br /><br /><b>The space</b><br />Welcome to my home.  1 Bedroom 1 bathroom set-up exclusively for guests. You will have the entire condominium to yourself. It has a very comfortable Queen size bed along with a ensuite bathroom with shower and balcony.  Rest of the condo and all the amenities of the building are for your use. Your room has your Closet - Dresser - Iron and Ironing Board - Beach Gear (chairs umbrella beach towels) - as well as Toiletries if needed - you are more that welcome to use in unit W",The Marina District is the 'crown jewel' of downtown - close to everything yet quite - clean - and safe. Walk score of  94!  Eat Drink Play Work all at your doorstep.
2057123,"Silver Terrace Delight by Old Town, Sea World, Bay","This is a recently constructed unit (2014) built over a garage in a very central neighborhood of San Diego and is minutes away from most of San Diego's major attraction.  A highlight is the roof top deck used for brunches and fireworks views<br /><br /><b>The space</b><br />The home is part of three units on the property.  The previous garage was removed and rebuilt with unit on the top.  The other two units are also rented out to Airbnb guests.<br /><br />The space is made up of a flexible floor plan that can see the family room turned into a separate bedroom via an opaque sliding glass door.<br /><br />What makes this property unique is it's recent construction and roof top deck with impressive views of The Presidio of San Diego - a historic fort established in 1769 by Gaspar de Portola, leader of the first European land exploration of Alta California.  It was the first permanent European settlement on the Pacific Coast of the United States.  <br /><br />During summers, the view of t","The neighborhood is a very central one located minutes from numerous amenities such as:  Sea World, Mission Bay, Mission Beach, Old Town, Downtown, Fashion Valley Mall, Qualcomm Stadium, and La Jolla."
2083989,Private Guest Suite - 4 blocks from beach,"This guest suite is very private and feels like it’s own separate unit. It's located within a very clean and charming 1918 Craftsman-style home. It has it’s own entrance, living room & kitchenette, bedroom, private half bathroom and outdoor patio. The shower is located in the 2nd bathroom just a few feet outside of your suite within a private hallway. Although the 2nd bathroom is shared with the host, it is very private, clean and available anytime of the day or night.<br /><br /><b>The space</b><br />PRIVATE SUITE INCLUDES:<br />- It's own private entrance<br />- Private living room & kitchenette<br />- Private bedroom<br />- Private half bathroom with toilet and sink. <br />- Private patio<br />- Off-street parking space in driveway<br />- Maximum occupancy is 2 individuals of any age <br />The 2nd bathroom with the shower is considered a ""shared space"" because it's shared with the host. It is very private, clean and accessible for showering any time of day or night. The 2nd bathroom","Ocean Beach is one of the more laid back and relaxing beach towns in San Diego. Yoga studios, coffee houses, restaurants and of course, the beach! The main street is only a few blocks away with shopping and night life. If healthy food options are important to you, the local co-op is 1 block away. Sea World is 1 mile away. Balboa Park and the world famous San Diego Zoo are a 10 minute drive. A 10 minute drive will also bring you to Hillcrest or downtown San Diego with it's historic Gaslamp Quarter and well-known night life. The beachfront amusement park, Belmont Park, is only 2 miles away if you'd like to ride the Giant Dipper roller coaster or be whirled around on some of the other rides. For information on more things to do in the area, look at the ""Guidebook"" section of this listing."
2088659,**South Mission Beach-front House**,"Beautiful Oceanfront 3bd/2ba House! 10 Feet From The Sand. Large Patio! <br />Upstairs unit.<br /><br /><b>The space</b><br />Renting out 1 private room in a spacious and sunny oceanfront 3 bedroom 2 bath house, offering fantastic ocean views throughout. Amenities include Full kitchen with microwave, oven and stove, dishwasher, freezer/frig, pots, pans, plates, utensils, glasses, coffee maker, etc., Free local and Long Distance phone calls, Free WIFI Internet, Free Digital Cable, TVs in living room and master bedroom, DVD Player, FREE washer/dryer. 2 parking spots, 1 garage /1 outside next to building. <br /><br />It is OCEAN FRONT with just the boardwalk separating you from the sand! LARGE deck patio space (over twice size as North Mission houses) with BBQ grill and gas fire pit, 8 chairs, 4 lounge chairs with cushions, outside dinner table with benches, 2 hoses. 5 permanently set up volleyball courts right out in front.<br /><br />This property is just south of (1/4 mile, 5 minute wa",
2092631,Modern 3 bdrm Apt in Banker's Hill,"Stay in my stylish apartment conveniently close to all that San Diego has to offer! Centrally located in the heart of San Diego very near Balboa Park (and the San Diego Zoo) in the affluent Banker's Hill neighborhood.<br /><br /><b>The space</b><br />This three bedrooms and two baths apartment is located on the second floor.  It accommodates up to six people comfortably.  The unit is fully furnished and will make you a nice home base in San Diego.<br />Each bedroom has a queen size bed.  The cozy dining/living room features a comfortable bench with cushions, a flat screen TV with access to Apple TV for Netflix, YouTube and iTunes. High-speed wireless internet is provided with WiFi. The kitchen is fully equipped with a gas stove, microwave, dishwasher, and refrigerator.  If you prefer home cooking, kitchen utensils, pots, and pans are also available for your convenience.  Provided also are freshly laundered bedding, bath towels and basic toiletries.  <br />Parking is metered street park","The apartment is in the neighborhood of Banker's Hill, which is located in central San Diego between the Gaslamp District and Hillcrest. It is a pedestrian friendly neighborhood.  Even though it is only one block away from Balboa Park, it has all the benefits of urban living. There are several convenience stores and smaller markets close by. Supermarkets and pharmacies are within a mile radius of the apartment.  There is a nice selection of coffee shops, cafes and restaurants within walking distance of the apartment. Enjoy great night life, fine dining and shopping whether you head one mile south to the Gaslamp District or one mile north to Hillcrest.  Balboa Park is just one block east of the apartment where you will find the San Diego Zoo, a variety of museums, hiking trails, and bike paths.  Seaworld and the beaches are about 15 minutes away by car."
2093833,Backyard Paradise near Mission Bay,"Our guest room is situated in a private corner of our home w/ a private bath, a huge kitchen, and a gorgeous outdoor eating area!  We are centrally located, on a quiet street, 1 mile from Mission Bay, and 3 miles from the beach.<br /><br /><b>The space</b><br />Enjoy the gorgeous weather of San Diego in an outdoor paradise.  Centrally located in a quiet suburb of the city.  <br /><br />The room is very private, located in the corner of the house, with a private bathroom, separated from common areas by a long hallway.  Large room has a queen bed, chairs, and dressers.<br /><br />We are a dog friendly home, our Labs are a huge part of our lives and they want to be a part of yours!  We have a gate up across the hallway so you can block them from coming into the guest room & bathroom area if you want some space or leave it open & let them come say hi... <br /><br />We are finishing up with some remodeling.  You'll notice a few touch up areas in progress - like baseboards. <br /><br />We ha","Quiet, friendly neighborhood that is safe and private.  Only one way access road to our street.  Grocery store is right around the corner and the local coffee shop is even closer."
2111974,"""Granada House"" North Park Urban Cottage","Come relax in our urban cottage! Just steps to the center of North Park, 1 block from Observatory Theater. Enjoy a private space & a peaceful outdoor area including backyard chickens... Feel like a true North Parker<br /><br /><b>The space</b><br />We have a comfortable cottage for rent in the highly sought-after neighborhood of North Park in San Diego. You, as our guest(s), will be staying in a quaint space with your own four walls for privacy and private bathroom and small kitchenette. This little bonus spot was originally built in the 1940s (hence the original wood panelling & fireplace) but we updated it 5 years ago adding some modern amenities - including brand new AC & heater system. Spread out and enjoy the outdoor living area with comfy couches, hammocks, movie projector, ... and more! We can't provide food due to city zoning laws but most people want to explore all the great local coffee shops, breweries, & restaurants anyway! The cottage will be stocked with coffee and tea fo","Within a 5 minute walk you can reach most of the best restaurants, bars, and breweries in North Park. On a brewery tour? You can catch at least 6 different tasting rooms on one jaunt: Modern Times, Hess, Thorn Street, North Park Brewing, Belching Beaver, Fall Brewing to name a few..<br /><br />We are happy to give suggestions!"
2122584,Baywatch in San Diego,"Enjoy the ambiance of a beautiful home with panoramic views of Mission Bay.   Plan your day while sitting by a resort-like pool and back yard.  Then, take in the nearby sights (La Jolla, Gas Lamp District, Sea World, Old Town, Zoo).<br /><br /><b>The space</b><br />Stay in a lovely, welcoming home and enjoy tropical back yard views as well as panoramic views of Mission Bay.  You'll love relaxing on the deck or watching fireworks and a view of the city lights while reclining in your queen sized bed watching Netflix.   Your somewhat compact room features mirrored sliding doors and French doors leading out to a large deck.  Deck views overlook an inviting pool with lush tropical growth. as well as sparkling Mission Bay.<br /><br /><b>Guest access</b><br />Guests are welcomed and encouraged  to use the pool and deck area.  However, the pool is heated thermally so it is generally warmer in the summer and early fall months and the spa is not part of amenities due to high expense of heating.<",The wonderful thing about this neighborhood is the fact that it is quite safe and very accessible to the freeway.  It is close to beaches and the downtown area.  It also has a mild climate due to its proximity to the water.
2124940,Cozy & Elegant 1BR -CloseToTheBeach,"Cozy, well-decorated apartment in the heart of Pacific Beach. <br />Neighborhood: safe & friendly; located walking distance to the beach, the bay, and an extensive variety of bars, restaurants, and stores.<br /><br /><b>The space</b><br />Cozy, well-decorated apartment in the heart of Pacific Beach. <br />Neighborhood: safe & friendly; located walking distance to the beach, the bay, and an extensive variety of bars, restaurants, and stores. <br /><br />Apartment: white-red themed apartment with leather furniture and carpeting; white leather couch and flat screen TV in the living room and a spacious round white leather bed in the bedroom. The kitchen has an oven, microwave, ""Keurig"" coffee maker, and a kettle at your full disposal. All furniture was purchased brand-new less than a year ago. The place comfortably fits 2 people. <br /><br />One parking space in the back. Plenty of parking on the street. <br /><br /><br /><br />The apartment is located minutes away from the “strip” (Garnet","The apartment is located minutes away from the “strip” (Garnet Ave) where eateries and bars line the street for a few blocks. Safe and friendly neighborhood that you can explore and enjoy. Everything is nearby and tons of things to do: bike rentals, surfing, hookah lounges, clothing stores, etc."
2130260,La Jolla Craftsman Charmer,"This wood and glass home was designed and built by a Frank Lloyd Wright protege. It is quiet, nestled in the trees, and just a few blocks to the world famous Wind N Sea Beach. We live along the bike path for easy access to anywhere in La Jolla.<br /><br /><b>The space</b><br />Lots of wood and glass surrounded by trees makes this a cozy and welcoming home.  The three patios surrounding the home provide several options for outdoor relaxing and enjoyment.<br /><br /><b>Guest access</b><br />Guests will have total access to the house; please treat it as your own. Please note that we have a cockapoo (dog) which requires food and water. All of the guests that have stayed here have truly enjoyed caring for our pet.<br /><br /><b>Other things to note</b><br />4 day minimum.","Our home is a perfect La Jolla location.  Four short blocks to the beach, situated on the bike path, one mile from the center of the village.  A 20 minute drive to Sea World or the world famous San Diego Zoo."
2145806,Zen bedroom in SD/SouthPark home,"Light,bright comfortable bedroom for 1-2 people in a beautiful home in the cool neighborhood of SouthPark. Close to restaurants, Gaslamp/downtown, Balboa Park and the zoo! Bus within walking distance. Enjoy kitchen privileges and private bath.<br /><br /><b>The space</b><br />The bedroom is big enough for 1 or 2 people with a queen size tempur pedic bed.  The bathroom will be private for you and has a tub/ shower ( the owner does keep a few things in that bathroom for storage only).  The backyard is beautiful for viewing from the balcony or feel free to walk down into the yard and enjoy sitting on the love seat swing surrounded by nature.<br /><br /><b>Guest access</b><br />Guests have access to a fully stocked kitchen.  A flat screen TV is in the bedroom as well as wifi.  Coffee/ tea/ light continental breakfast provided. Feel free to grill on the BBQ on the balcony.  Laundry facilities are available on the property.  Parking is available on street and is never a problem. The downstai",SouthPark has a great neighborhood feel to it.  There are restaurants and bars(wine bars and micro brew) within walking distance. Two wonderful yoga studios are nearby (Ginseng and Mosaic).  We are close to the Gaslamp/downtown SD and Convention Center.  Balboa Park and the Zoo are a 5 minute drive away!
2150364,Studio - Beach & Boardwalk are Open-Book Now!,"Studio apartment with Boardwalk Patio privileges.  <br /><br />The studio has a kitchen area with small table and chairs. <br /><br />The bathroom has a show/tub combination.<br /><br />NO SMOKING ALLOWED.<br /><br /><b>The space</b><br />Studio apartment with Boardwalk Patio privileges.  The studio has a kitchen area with small table and chairs. The bathroom has a show/tub combination.<br /><br />PLEASE READ AND AGREE BEFORE INQUIRING: The unit is suitable only for 2 adults (a couple possibly with one infant or small child - 5 years old or younger). There is no access to the patio for non-guests. Due to the small shared area of the patio available to the studio, no one can be invited to come to the patio.<br /><br />Mission Beach studio apartment. This unit may be rented in conjunction with an oceanfront beach house. See vacation rental by owner listing 4 5 5 1 2 8.<br /><br />Consider staying during off-peak season times.<br /><br />If families want to get together to book for 4 week","Mission Beach is a dynamic place with a lot going on. The studio is centrally located within walking distance to Belmont Park (Amusement Park) to the south, and Pacific Beach to the north."
